{
  "schema_version": 1,
  "milestone_id": "m1",
  "display_name": "M1",
  "depends_on": [
    "m0"
  ],
  "doc_refs": [
    "_workspace/02-core-app.md",
    "CONTEXT.md"
  ],
  "tasks": [
    {
      "task_id": "m1-1",
      "queue_number": 4,
      "title": "WinUI 3 app + main window bootstrap",
      "status": "pending",
      "summary": "Create the WinUI 3 application entrypoint and first MainWindow bootstrap.",
      "depends_on": [
        "m0-1"
      ],
      "doc_refs": [
        "_workspace/02-core-app.md",
        "_workspace/15-scaffolding.md"
      ],
      "touches": [
        "src/app",
        "src/ui"
      ],
      "acceptance_auto": [
        "cmake --build --preset dev-x64 --target cmux_app"
      ],
      "acceptance_manual": [
        "manual: verify first MainWindow creation on STA thread"
      ],
      "commands": [
        "cmake --build --preset dev-x64 --target cmux_app"
      ],
      "outputs": [
        "src/app/App.xaml",
        "src/app/App.xaml.cpp",
        "src/ui/MainWindow.xaml",
        "src/ui/MainWindow.xaml.cpp"
      ],
      "blocked_by": [],
      "notes": []
    },
    {
      "task_id": "m1-2",
      "queue_number": 4,
      "title": "WindowManager and window lifecycle",
      "status": "pending",
      "summary": "Implement WindowManager and the canonical lifecycle states.",
      "depends_on": [
        "m1-1"
      ],
      "doc_refs": [
        "_workspace/02-core-app.md"
      ],
      "touches": [
        "src/app",
        "src/core"
      ],
      "acceptance_auto": [
        "cmake --build --preset dev-x64 --target cmux_app",
        "ctest --preset dev-x64 -R window_manager --output-on-failure"
      ],
      "acceptance_manual": [
        "manual: verify active window tracking and close order"
      ],
      "commands": [
        "cmake --build --preset dev-x64 --target cmux_app",
        "ctest --preset dev-x64 -R window_manager --output-on-failure"
      ],
      "outputs": [
        "src/app/WindowManager.h",
        "src/app/WindowManager.cpp",
        "src/core/window_lifecycle.h"
      ],
      "blocked_by": [],
      "notes": []
    },
    {
      "task_id": "m1-3",
      "queue_number": 4,
      "title": "Titlebar / backdrop / fallback",
      "status": "pending",
      "summary": "Implement titlebar customization and backdrop fallback behavior (Mica default; style-driven fallback per 00 §4 Win11 22H2+ floor).",
      "depends_on": [
        "m1-1"
      ],
      "doc_refs": [
        "_workspace/02-core-app.md",
        "_workspace/09-config-settings.md"
      ],
      "touches": [
        "src/ui",
        "src/app"
      ],
      "acceptance_auto": [
        "cmake --build --preset dev-x64 --target cmux_app"
      ],
      "acceptance_manual": [
        "manual: verify backdrop fallback matches support matrix"
      ],
      "commands": [
        "cmake --build --preset dev-x64 --target cmux_app"
      ],
      "outputs": [
        "src/ui/titlebar.h",
        "src/ui/titlebar.cpp",
        "src/ui/backdrop_helper.h",
        "src/ui/backdrop_helper.cpp"
      ],
      "blocked_by": [],
      "notes": []
    },
    {
      "task_id": "m1-4",
      "queue_number": 4,
      "title": "App command surface + auxiliary windows",
      "status": "pending",
      "summary": "Implement the app-level command surface and the Settings/About auxiliary AppWindows with single-instance ownership.",
      "depends_on": [
        "m1-2"
      ],
      "doc_refs": [
        "_workspace/02-core-app.md",
        "_workspace/02-core-app.md#7-app-command-surface--보조-창-auxiliary-windows",
        "_workspace/17-functional-spec.md#87-settings-window--preferences-ui"
      ],
      "touches": [
        "src/app",
        "src/ui"
      ],
      "acceptance_auto": [
        "cmake --build --preset dev-x64 --target cmux_app"
      ],
      "acceptance_manual": [
        "manual: verify app commands route through the single command surface and delegate to WindowManager/TabManager",
        "manual: verify open-settings twice keeps exactly 1 Settings window and re-activates the existing one (single-instance); About behaves identically (02 §7.4)",
        "manual: verify closing an auxiliary window does not terminate the app while a main window is alive (02 §7.4)",
        "manual: verify About window displays version and build identifier"
      ],
      "commands": [
        "cmake --build --preset dev-x64 --target cmux_app"
      ],
      "outputs": [
        "src/app/app_command_surface.h",
        "src/app/app_command_surface.cpp",
        "src/ui/settings_window.xaml",
        "src/ui/settings_window.xaml.cpp",
        "src/ui/about_window.xaml",
        "src/ui/about_window.xaml.cpp"
      ],
      "blocked_by": [],
      "notes": []
    },
    {
      "task_id": "m1-5",
      "queue_number": 4,
      "title": "Titlebar chrome controls (drag region, accessor seam, toolbar, command buttons)",
      "status": "pending",
      "summary": "Implement the draggable titlebar handle, window accessor hook, toolbar controller, and titlebar command buttons with shortcut hints.",
      "depends_on": [
        "m1-3"
      ],
      "doc_refs": [
        "_workspace/02-core-app.md",
        "_workspace/02-core-app.md#8-draggable-titlebar-handle-drag-region",
        "_workspace/02-core-app.md#9-window-accessor-hook-appwindowhwnd-seam",
        "_workspace/02-core-app.md#10-toolbar-controller-titlebar-command-region",
        "_workspace/02-core-app.md#11-titlebar-controls--shortcut-hints"
      ],
      "touches": [
        "src/ui",
        "src/app"
      ],
      "acceptance_auto": [
        "cmake --build --preset dev-x64 --target cmux_app"
      ],
      "acceptance_manual": [
        "manual: verify empty titlebar drag moves the window and drag over interactive controls does not (02 §8.3)",
        "manual: verify titlebar double-click toggles maximize/restore (02 §8.3)",
        "manual: verify backdrop/titlebar config obtains AppWindow/HWND only via the accessor seam on the UI thread (02 §9.3)",
        "manual: verify titlebar title text updates to the active workspace and command button state mirrors core model (02 §10.3)",
        "manual: verify sidebar/new-workspace/notifications buttons trigger their actions and tooltips show shortcut hints from the 09 schema (02 §11.3)",
        "manual: verify notifications button shows an unread badge when unread > 0 (02 §11.3)"
      ],
      "commands": [
        "cmake --build --preset dev-x64 --target cmux_app"
      ],
      "outputs": [
        "src/ui/titlebar_toolbar.h",
        "src/ui/titlebar_toolbar.cpp",
        "src/ui/titlebar_drag_region.h",
        "src/ui/titlebar_drag_region.cpp",
        "src/app/window_accessor.h",
        "src/app/window_accessor.cpp"
      ],
      "blocked_by": [],
      "notes": []
    },
    {
      "task_id": "m1-6",
      "queue_number": 2,
      "title": "Milestone AT gate (acceptance_manual drain)",
      "status": "pending",
      "summary": "Human/AT checkpoint: execute every queued acceptance_manual item in this milestone and record results before the milestone rolls up to done.",
      "depends_on": [
        "m1-1",
        "m1-2",
        "m1-3",
        "m1-4",
        "m1-5"
      ],
      "doc_refs": [
        "plans/README.md#at-gate-규칙"
      ],
      "touches": [
        "plans/milestones/m1.json"
      ],
      "acceptance_auto": [],
      "acceptance_manual": [
        "manual: verify every acceptance_manual item of this milestone's tasks was executed and its result (pass/fail/skip + 사유) recorded in this task's notes"
      ],
      "commands": [],
      "outputs": [
        "plans/milestones/m1.json"
      ],
      "blocked_by": [],
      "notes": [
        "commands: [] — human/AT gate task; done 전환은 사람 검증으로만 수행한다 (plans/README.md 'AT gate 규칙'). 자율 루프는 이 task를 집지 않는다."
      ]
    }
  ]
}
