{
  "schema_version": 1,
  "milestone_id": "m5",
  "display_name": "M5",
  "depends_on": [
    "m3",
    "m4"
  ],
  "doc_refs": [
    "_workspace/08-ipc-cli.md",
    "CONTEXT.md"
  ],
  "tasks": [
    {
      "task_id": "m5-1",
      "queue_number": 7,
      "title": "cmux.exe CLI + capabilities handshake",
      "status": "pending",
      "summary": "Implement the CLI entrypoint and the capabilities handshake path.",
      "depends_on": [
        "m3-1"
      ],
      "doc_refs": [
        "_workspace/08-ipc-cli.md"
      ],
      "touches": [
        "cli",
        "src/ipc"
      ],
      "acceptance_auto": [
        "cmake --build --preset dev-x64 --target cmux_cli",
        "ctest --preset dev-x64 -R cli --output-on-failure"
      ],
      "acceptance_manual": [
        "manual: verify capabilities response matches protocol version 2"
      ],
      "commands": [
        "cmake --build --preset dev-x64 --target cmux_cli",
        "ctest --preset dev-x64 -R cli --output-on-failure"
      ],
      "outputs": [
        "cli/main.cpp",
        "cli/cmux_client.h",
        "cli/cmux_client.cpp"
      ],
      "blocked_by": [],
      "notes": []
    },
    {
      "task_id": "m5-2",
      "queue_number": 7,
      "title": "Workspace/panel control commands",
      "status": "pending",
      "summary": "Implement CLI and IPC routing for workspace and panel control commands.",
      "depends_on": [
        "m5-1"
      ],
      "doc_refs": [
        "_workspace/08-ipc-cli.md"
      ],
      "touches": [
        "cli",
        "src/ipc",
        "src/core"
      ],
      "acceptance_auto": [
        "cmake --build --preset dev-x64 --target cmux_cli",
        "ctest --preset dev-x64 -R ipc_commands --output-on-failure"
      ],
      "acceptance_manual": [
        "manual: verify command routing matches the published command catalog"
      ],
      "commands": [
        "cmake --build --preset dev-x64 --target cmux_cli",
        "ctest --preset dev-x64 -R ipc_commands --output-on-failure"
      ],
      "outputs": [
        "cli/workspace_commands.h",
        "cli/workspace_commands.cpp",
        "src/ipc/command_dispatcher.h",
        "src/ipc/command_dispatcher.cpp"
      ],
      "blocked_by": [],
      "notes": []
    },
    {
      "task_id": "m5-3",
      "queue_number": 10,
      "title": "Crash/log/privacy policy freeze",
      "status": "pending",
      "summary": "Lock crash, logging, and privacy behavior before crash capture integration.",
      "depends_on": [
        "m0-6"
      ],
      "doc_refs": [
        "_workspace/07-notification.md",
        "_workspace/09-config-settings.md",
        ".rules/logging-privacy.md",
        ".rules/notifications-degrade.md"
      ],
      "touches": [
        "_workspace/07-notification.md",
        "_workspace/09-config-settings.md"
      ],
      "acceptance_auto": [],
      "acceptance_manual": [
        "manual: verify redaction policy is fixed in _workspace/07-notification.md per .rules/logging-privacy.md",
        "manual: verify analytics opt-in default is false per .rules/logging-privacy.md §analytics-policy",
        "manual: verify log rotation and sink rules are documented per .rules/logging-privacy.md §log-sink"
      ],
      "commands": [],
      "outputs": [
        "_workspace/07-notification.md",
        "_workspace/09-config-settings.md"
      ],
      "blocked_by": [],
      "notes": []
    },
    {
      "task_id": "m5-4",
      "queue_number": 10,
      "title": "Crash capture integration",
      "status": "pending",
      "summary": "Implement crash capture only after crash and privacy policy is frozen.",
      "depends_on": [
        "m5-3"
      ],
      "doc_refs": [
        "_workspace/adr/adr-0002-conpty-passthrough-fallback.md",
        "_workspace/09-config-settings.md"
      ],
      "touches": [
        "src/core/crash_reporter.h",
        "src/core/crash_reporter.cpp",
        "vcpkg.json"
      ],
      "acceptance_auto": [
        "cmake --preset dev-x64",
        "cmake --build --preset dev-x64 --target cmux_app"
      ],
      "acceptance_manual": [
        "manual: verify crash capture honors the frozen log/privacy policy from m5-3",
        "manual: verify Crashpad is initialized via InitializeCrashpad() before any other app logic",
        "manual: verify minidump is generated in %LOCALAPPDATA%\\cmux\\crashes\\ on simulated crash",
        "manual: verify crash reporter respects analytics opt-in setting (no upload if opted-out)"
      ],
      "commands": [
        "cmake --preset dev-x64",
        "cmake --build --preset dev-x64 --target cmux_app"
      ],
      "outputs": [
        "src/core/crash_reporter.h",
        "src/core/crash_reporter.cpp"
      ],
      "authoritative_rules": [
        ".rules/settings-persistence.md"
      ],
      "blocked_by": [],
      "notes": [
        "Crashpad must be added to vcpkg.json manifest (NOT via ad-hoc 'vcpkg install crashpad'). Add to dependencies array: { \"name\": \"crashpad\" }.",
        "Verify microsoft/vcpkg baseline includes crashpad before adding to vcpkg.json.",
        "InitializeCrashpad() minimum signature: bool InitializeCrashpad(const std::filesystem::path& handler_path, const std::filesystem::path& db_path)",
        "crash handler binary (crashpad_handler.exe) must be packaged with app deployment"
      ]
    },
    {
      "task_id": "m5-5",
      "queue_number": 7,
      "title": "Input-simulation IPC implementation",
      "status": "pending",
      "summary": "Implement simulate_type/simulate_file_drop/simulate_shortcut/is_terminal_focused.",
      "depends_on": [
        "m3-8",
        "m5-1"
      ],
      "doc_refs": [
        "_workspace/08-ipc-cli.md#13-debug-and-automation-ipc",
        "_workspace/17-functional-spec.md#49-파일-드롭-수신"
      ],
      "touches": [
        "src/ipc",
        "tests/unit/ipc"
      ],
      "acceptance_auto": [
        "cmake --build --preset dev-x64 --target cmux_app",
        "tc-simulate-type: simulate_type injects text into the target surface",
        "tc-simulate-file-drop: simulate_file_drop injects an escaped path paste",
        "ctest --preset dev-x64 -R input_sim --output-on-failure"
      ],
      "acceptance_manual": [],
      "commands": [
        "cmake --build --preset dev-x64 --target cmux_app",
        "ctest --preset dev-x64 -R input_sim --output-on-failure"
      ],
      "outputs": [
        "src/ipc/input_sim_commands.h",
        "src/ipc/input_sim_commands.cpp",
        "tests/unit/ipc/test_input_sim.cpp"
      ],
      "blocked_by": [],
      "notes": []
    },
    {
      "task_id": "m5-6",
      "queue_number": 7,
      "title": "Sidebar/status IPC commands",
      "status": "pending",
      "summary": "Implement set_status/clear_status/report_git_branch/report_ports/sidebar_state + --tab/--panel targeting.",
      "depends_on": [
        "m3-5",
        "m5-1"
      ],
      "doc_refs": [
        "_workspace/08-ipc-cli.md#14-sidebar-and-status-ipc-commands",
        "_workspace/05-sidebar-tabs.md#ipc-경유-sidebar-메타데이터"
      ],
      "touches": [
        "src/ipc",
        "src/core",
        "tests/unit/ipc"
      ],
      "acceptance_auto": [
        "cmake --build --preset dev-x64 --target cmux_app",
        "tc-set-status: set_status updates workspace status_entries and projects to the sidebar",
        "tc-report-ports: report_ports updates listening_ports metadata",
        "ctest --preset dev-x64 -R sidebar_status --output-on-failure"
      ],
      "acceptance_manual": [],
      "commands": [
        "cmake --build --preset dev-x64 --target cmux_app",
        "ctest --preset dev-x64 -R sidebar_status --output-on-failure"
      ],
      "outputs": [
        "src/ipc/sidebar_status_commands.h",
        "src/ipc/sidebar_status_commands.cpp",
        "tests/unit/ipc/test_sidebar_status.cpp"
      ],
      "blocked_by": [],
      "notes": []
    }
  ]
}
